{
  "schemaVersion": "1.0.0",
  "rootKeyId": "nara-stage2-root-2026",
  "algorithm": "ecdsa-p256-sha256",
  "contentSha256": "f44c2c1340b1045b73e2627904e2d93fd61b3da1a9ec5826d7fe36d19164d204",
  "signatureBase64": "MEUCIQDWRySLBJMY396QhgB0BD+X0sTNLdDwVRuMbr+iZ/kYqwIgeWWL5cdiEnKLPD1VT/wGf0BDIPLwYVrJJu+glnUca1E="
}
