{
  "schemaVersion": "1.0.0",
  "rootKeyId": "nara-stage2-root-2026",
  "algorithm": "ecdsa-p256-sha256",
  "contentSha256": "0f7dddb2c9388f16142791d8b14ef03375d685e4b775e57b9dfbbe8343504be6",
  "signatureBase64": "MEQCICdUkNoZfHe5VIchRcsNfeouK2zHAuPDmtmb2LkSKg/9AiA2eeJFKO+7SuLjI+/cqqkq7a4d+IL0+8BsjDOHaKGEhQ=="
}
